{
  "name": "rusty-brain-marketplace",
  "description": "rusty-brain plugin marketplace manifest",
  "owner": {
    "name": "Brian Luby",
    "url": "https://github.com/brianluby"
  },
  "plugins": [
    {
      "name": "rusty-brain",
      "description": "Persistent AI memory system using memvid video-encoded storage",
      "version": "0.1.0",
      "source": "./"
    }
  ]
}
